{
  "$schema": "https://json-schema.org/draft/2020-12/schema",
  "$id": "poc-lab://schema/app",
  "title": "Gallery app metadata",
  "description": "Optional per-app override written to apps/<slug>/meta.json. Every field is optional — anything absent is derived from the built HTML (title, description) or from git/mtime (created). A folder with no meta.json is fully valid.",
  "type": "object",
  "additionalProperties": false,
  "properties": {
    "slug": {
      "type": "string",
      "pattern": "^[a-z][a-z0-9-]*$",
      "description": "If present, must equal the folder name (enforced by validate.mjs)."
    },
    "title": { "type": "string", "minLength": 2, "maxLength": 80 },
    "description": { "type": "string", "maxLength": 240 },
    "tags": {
      "type": "array",
      "items": { "type": "string", "pattern": "^[a-z0-9][a-z0-9-]*$" },
      "uniqueItems": true,
      "maxItems": 8
    },
    "created": { "type": "string", "pattern": "^\\d{4}-\\d{2}-\\d{2}$" },
    "updated": { "type": "string", "pattern": "^\\d{4}-\\d{2}-\\d{2}$" },
    "source": { "enum": ["claude.ai", "claude-code", "handwritten", "other"] },
    "kind": { "enum": ["static", "buildable"] },
    "featured": { "type": "boolean" },
    "hidden": { "type": "boolean" }
  }
}
