{
  "slug": "brawl-combo-lab",
  "title": "Combo Lab — Brawl Stars",
  "description": "Combos, rôles et diagnostic d'équipe pour Brawl Stars — le pourquoi, pas un tier list. Bilingue FR/EN. · Searchable Brawl Stars combos and a comp doctor — principles, not a tier list.",
  "tags": ["jeu", "brawl-stars", "guide"],
  "created": "2026-07-17",
  "source": "claude.ai",
  "kind": "static"
}
